MovieID,Keywords
tt0105112,"ryan, ulster, sean, officers, terrorists, guards, jack, rescue, captured, troopers, officer"
tt1204975,"archie, billy, paddy, ronnie, flatbush, boys, grandson, bed, jackson, funeral, party"
tt0243655,
tt0040897,"dobbs, gold, cody, fred, prospector, fortune, lottery, prospecting, mined"
tt0126886,"reese, tracy, teacher, liaison, junior, student, senior, students, candidate"
tt0286716,"bruce, hulk, nanomeds, ross, scientist, talbot, banner, regeneration, experiments"
tt0090605,"ripley, alien, aliens, spacecraft, cat, survivors, stranded, unconscious, chamber, crew, presence, marine"
tt0243155,"bridget, colin, renee, firth, affair, hugh, jones, daniel, barrister, attraction, vows"
tt0121765,"anakin, skywalker, jedi, palpatine, hayden, padmé, lightsaber, yoda, darth, senate, senator, chancellor"
tt0443453,"borat, kazakhstan, kazakhstani, sagdiyev, movie, yusuf, filming, tv, hitchhike, television, tourist"
tt0107131,
tt0110364,
tt0450259,"leone, solomon, diamond, diamonds, stone, smuggling, rebels, poison, mercenary, rebel, liberia, danny"
tt0143145,"bond, assassin, banker, casino, mercenary, knife, bilbao, grenade, prisoner, escape, steals"
tt0435625,"whitewater, raft, rafting, underwater, rebecca, pool, natalie, molly, cabin, flooded, pond"
tt0343818,"roboticist, robot, robots, spooner, detective, robotics, machines, suicide, psychologist, interrogates, supercomputer, robo"
tt0120815,"normandy, flag, omaha, soldier, 1944, memorial, grave, cemetery, paratroopers, beach"
tt0253754,"commander, romulan, commanders, picard, uss, admiral, romulus, praetor, officer, captain, signature, signatures"
tt1951264,"katniss, hunger, peeta, uprising, district, mockingjay, rebellions, betray, rebellion, mellark, victors, victor"
tt0118849,"shoes, sneakers, zahra, ali, feet, footrace, siblings, shoemaker, movie, bicycle, scheme, pair"
tt0120783,"twins, twin, annie, daughters, nick, lindsay, queen, sister, camp"
tt0114814,"crewman, keyser, survivors, killer, smuggler, murderous, passenger, smugglers, killing, criminals, criminal, sgt"
tt0101700,
tt0377092,"lindsay, rachel, regina, cady, daughter, janis, plastics, queen, amanda, lacey, girls"
tt0102768,
tt1259521,"scene, movie, kristen, acting, cabin, holden, jules, curt, fate, doors, room"
tt2084970,"suspects, interrogated, imprisoned, interrogation, turing, prison, responsibility, detective, spy, security, criminal, attention"
tt0108399,"presley, detectives, clarence, elvis, alabama, comic, nicholson, movie, actor, drexl, cop"
tt0017136,"mediator, freder, fredersen, film, scene, johann, movie, rudolf, underworld, worker, workers, luxury"
tt2356777,"detectives, hunting, timelines, harrelson, mcconaughey, killer, season, woody, hart, cohle"
tt0215750,"koulikov, stalingrad, vassili, khrushchev, erwin, danilov, zaitsev, nikita, soviet, fiennes, sniper, 1942"
tt0082096,"1941, submarines, sailors, torpedo, captain, torpedoes, boat, germans, sunk, ww2, torpedoed"
tt0408985,
tt0107822,"piano, ada, teacher, oblivious, holly, scotswoman, music, interpreter, listening, speechless, poem"
tt1120985,"cindy, megan, frankie, ending, dog, movie, breakfast, romance, divorce, film, vows, gosling"
tt0018455,"summertime, townswomen, farmer, townsfolk, flashback, scene, sunrise, lingers, married, dinner, town"
tt0499448,"caspian, narnians, narnian, conqueror, narnia, leonine, dowager, prince, king, edmund, andreu"
tt0133152,"apes, ape, astronaut, leo, chimpanzee, primates, oberon, human, wahlberg, pericles, humanoid"
tt1289401,"ghost, ghostly, ghosts, haunting, ghostbusters, garrett, possessed, door, nightstand, aldridge, rooms, mansion"
tt2101441,"faith, vanessa, childhood, friends, spring, spiritual, candy, selena, rachel, ashley, classmates, soul"
tt0475784,"dolores, maeve, cullen, lowe, clementine, unconscious, dies, charlotte, elsie, hale, dead, logan"
tt1536537,
tt0113957,"thief, angela, devlin, theft, discovers, purse, stolen, stole, computer, colleague, files, steal"
tt0100507,"rocky, boxing, heavyweight, boxers, tony, creed, championship, champion, tommy, contender, duke, fighter"
tt0302886,"mitch, mitchs, snoop, vaughn, vince, juliette, partying, party, acquaintance, house, palooza"
tt0460681,
tt3011894,
tt0114319,"sabrina, holly, lauren, julia, playboy, daughter, crenna, maude, tyson"
tt3748528,"galen, lyra, galactic, jyn, stardust, crystal, necklace, empire, orb, galaxy, gerrera"
tt0107207,"guildford, bombings, belfast, bombing, irishmen, paddy, maguire, suspects, terrorism, policemen, irish"
tt0120363,"squeaktoy, woody, toy, squeaker, toys, wheezy, barn, doll, penguin, yard, yells"
tt0109707,"cast, actors, film, actor, films, acting, movie, scene, theater, movies, filmed, filming"
tt0103893,"buffy, vampire, vampires, slayer, dawn, coven, merrick, evil, sutherland, necks, kristy, killing"
tt1217209,"bear, fergus, merida, bow, archery, forest, elinor, emerges, enchanted, arrows, woods, daughter"
tt0116126,
tt0140352,"hezbollah, bergman, wigand, lebanon, tobacco, sheikh, lawsuit, attorney, liane, williamson, ceo, lawyer"
tt0406375,"game, play, playing, gravity, life, space, boys, sleepy, rules, finish, bed, trapped"
tt0120794,"nile, egyptians, moses, pharaoh, servant, exodus, egyptian, slaves, hebrews, israelites, reed, river"
tt3659388,"martian, astronauts, nasa, mars, hermes, crew, spacecraft, shuttle, flight, mission, kristen, pilot"
tt0160127,
tt0103772,"detective, detectives, boz, roxy, murder, trammel, investigators, murdered, murderer, sfpd, crime, suspect"
tt0099810,"sinking, sank, waking, submarine, submarines, boat, scenes, diver, cabin, morning, soviets, diving"
tt0116705,
tt0298148,"shrek, fiona, prince, fairy, godmother, donkey, royal, voiced, dragon, ogre, kingdom, frog"
tt0351283,"marty, park, zoo, lion, alex, giraffe, zebra, gift, penguin, globe, birthday, penguins"
tt0102744,"quigley, rifleman, gunslingers, sharpshooting, rifle, cowboy, shooting, selleck, shoots, rickman, gunshot, bullet"
tt1298650,"sparrow, jack, pirate, captain, blackbeard, privateer, johnny, depp, impostor, nemesis, captured"
tt1187064,"jess, boat, sailing, emma, cruise, tommy, cabin, wind, harbor, storm, encounters"
tt0149261,"shark, sharks, aquatica, underwater, swims, boat, sea, scientists, submarine, alzheimer, swim, mako"
tt0106977,"flashes, policeman, detective, helen, kimbles, kimble, flashing, city, flashback, reporter, helens, policemen"
tt0452594,"gary, brooke, brookes, dennis, marilyn, cubs, johnny, wrigley, selfishness, cole"
tt2660888,"kirk, starfleet, starship, scotty, mccoy, vulcan, federation, captain"
tt0103064,"casualties, cyborgs, cyborg, destruction, robot, war, soldier, terminator, enemy, explosion, grenades, androids"
tt0959337,"scene, frank, actress, actresses, actors, jennifer, movie, helen, drama"
tt0295700,"stranded, desmond, cabin, scene, scott, forest, woods, cliff, jessie"
tt0107048,"groundhog, punxsutawney, holiday, february, murray, newscast, day, meteorologist, connors, celebration, parade"
tt0416320,"rhys, johansson, emily, chloe, cousin, actress, wilton, scarlett, matthew, hewett"
tt0353969,"murders, suspects, detective, murder, yoon, detectives, crimes, crime, murdered, killer, suspect, seoul"
tt0405159,"frankie, boxer, scrap, boxing, fights, eastwood, punches, morgan, maggie, fighters, fighting, ending"
tt1781769,"anna, karenin, moscow, alexi, dolly, stiva, russian, nikolai, olivia, katerina, sister"
tt0337741,"erica, marin, actress, zoe, keanu, julian, amanda, nicholson, fiancée, reeves"
tt0120828,
tt0120903,"mutants, xavier, mutant, wolverine, marie, kelly, cyclops, magneto, mutation, jean, rogue, disguised"
tt0232500,"racers, dominic, racer, racing, honda, vince, motorcycles, dom, scene, bikers"
tt0113442,
tt0396171,"perfume, perfumer, fragrances, scent, perfumes, scents, grenouille, smell, smells, essence, odors, baldini"
tt0458352,"miranda, emily, fashionistas, designer, fashion, magazine, runway, assistant, anne"
tt1392190,"rockatansky, reinforcements, battle, warlords, warrior, villain, survivors, hostage, citadel, lair, army"
tt0458339,"tonsberg, headlights, viking, kamikaze, johann, nazi, nazis, odin, roof, norway, sarcophagus, helmet"
tt0110322,"scene, battle, colonel, wounded, heartrending, troops, veteran, cinematography, wars, battles, teepees, thelma"
tt0324216,"hitchhiker, trailer, trucker, shack, lynyrd, jedediah, kidnapped, scene, sheriff, handcuffed, murderous"
tt0382625,"vinci, langdon, magdalene, louvre, templar, priory, silas, pope, tomb"
tt0101545,"jimwood, mcclellend, dodge, murder, mcclelland, fired, murdered, saltburg, scene, movie"
tt0360486,"demons, constantine, supernatural, exorcisms, constantines, exorcising, spirits, keanu, occult, demon, possessed"
tt0129290,
tt1228705,"stark, tony, iron, avengers, romanoff, thor, expo, fury, nick, powers, suits, suit"
tt1430132,"nagasaki, logan, wolverine, yamamura, yashida, samurai, jackman, soldiers, prison, cell"
tt0133093,"cypher, trinity, informant, neo, cellphone, interrogation, matrix, calls, morpheus, carrie, trace, deciphered"
tt0103241,
tt0230011,"atlantis, milo, leviathan, sunken, ocean, expedition, sea, cavern, underground, giant, creature, stone"
tt0887912,"detonated, explosive, explosion, explosives, blast, grenade, bombs, bomb, explode, detonating, drone, artillery"
tt0376994,"xavier, mutant, jean, mutants, wolverine, cyclops, magneto, cameron, stewart, olivia, robot, mckellen"
tt0101889,"jack, lucas, fisher, parry, tormentor, tale, percival, king, legend, rescued"
tt0106582,"mountain, climbing, climb, climbed, cliff, rocky, ranger, mountains, chopper, rescue, scene, ladder"
tt1591095,"josh, scene, renai, paranormal, darkness, disturbing, film, disturbed, dark, spirits, room"
tt5439796,"boone, jimmy, bobbie, virginiajimmy, lynchburg, west, sadie, county, tatum, logan, speedway"
tt0408236,"barker, sweeney, barkers, barber, todd, nellie, barbering, johanna, rickman, barbershop, benjamin"
tt0117218,"obesity, hamster, hamsters, obese, fat, fattest, overweight, laboratory, perkins, scientist, pounds, weight"
tt1355644,"starship, hibernation, space, blinks, wakes, meteor, cabin, avalon, awake, voyage, planet, pod"
tt5580390,"elisa, pie, movie, zelda, voice, hawkins, giles, scream, monster, film, jenkins"
tt0461770,"kisses, kiss, lips, giselle, fairytale, princess, kissing, scene, movie, fairy, servant"
tt0038650,"angels, angel, guardian, george, clarence, movie, bailey, scene, james, heavenward"
tt0234215,"carrie, trinity, matrix, scene, rooftop, rain, green, gunfire, motorcycle, code, keanu, silhouette"
tt1091191,"taliban, insurgents, seals, afghanistan, shah, sniper, soldiers, marines, seal, insurgent, reconnaissance"
tt0117666,"movie, murder, murders, doyle, asylum, robert, custody, walsh, raped"
tt0765429,"richie, godfather, frank, film, vegas, vietnam, detective, mobsters, drug, cash, prison"
tt0116996,"newscaster, newscast, martian, martians, kessler, aliens, mars, james, president, satellite"
tt0319061,"edward, bloom, tales, billy, tale, wedding, mildred, engaged, twins, teller, storyteller, twin"
tt0050783,"cabiria, giorgio, giulietta, lazzari, wanda, nazzari, alberto, glamorous, laughing, masina, laughs"
tt0118749,"movie, actor, wahlberg, film, actors, eddie, scene, movies, jack, films, furious, acting"
tt0340855,"aileen, wuornos, selby, prostitute, prostitution, worm, murders, murder, kills, blood, murderers, brutally"
tt0046912,"margot, tony, wendice, wendices, mark, tennis, murder, divorce, murdering, convicted, inflicted, murdered"
tt2262227,"mary, dolls, voices, voice, spirits, voiced, manolo, folklore, gabriel, spirit, posada"
tt0107362,"ripper, gunfire, gunmen, schwarzenegger, killer, terminator, officer, hostage, officers, murderous, murder, murdering"
tt0369436,"brad, christmases, reese, christmas, divorces, couples, toys, movie, presents, vaughn, couple"
tt1673434,"bella, cullen, cullens, vampire, vampires, jake, blood, edwards, wolves, lion, garrett"
tt0469494,"plainview, wells, daniel, contractor, drilling, planview, ore, landowners, drill, lewis, gusher, dynamite"
tt5247022,
tt2089750,
tt0087544,
tt1663662,"jaegers, jaeger, kaijus, kaiju, monsters, kong, monster, giant, helicopter, typhoon, creatures, tides"
tt0109045,
tt0418832,
tt1860357,"dino, dinosaurs, rabbit, dinosaur, wahlberg, film, gina, deepwater, tames"
tt0389860,"angel, time, realizes, magical, remote, chance, undo, story, love, life, opportunities, woman"
tt0184858,
tt0104990,"newspaper, pulitzer, newsies, newspapers, newsboys, reporter, headlines, news, correspondent, hearst, publicity"
tt2042568,"llewyn, musical, hang, song, singer, dylan, ballad, musician, cat, sleeping, album"
tt0241527,"potter, radcliffe, hogwarts, muggle, dumbledore, dursley, voldemort, wizard, wizardry, slytherin, dursleys"
tt0285742,"hank, murderer, thornton, diddy, sonny, mortally, kills, grotowski, buck, billy, death, grandfather"
tt1496422,"yardley, ward, charlotte, wetter, reporter, murder, innocence, handcuffed, mcconaughey, kidman, alleged"
tt0120744,"musketeers, parisian, muskets, pierre, jesuit, athos, philippe, malkovich, jesuits"
tt1840309,"factions, faction, factionless, uniforms, colors, shade, orange, red, wear, members, yellow"
tt0119396,"bail, suspects, detective, ordell, arrest, jail, arrested, murder, bondsman, jackson, steals"
tt0988045,"holmes, sherlock, moriarty, adler, henchman, stairs, execution, constable, yard, reilly, staircase"
tt0253867,
tt0130236,
tt0138704,"numbers, movie, madness, extreme, mathematics, anxiety, film, cohen, maximilian, math, clairvoyant"
tt2543472,
tt0102057,"maggie, dustin, cast, hangman, hook, liza, granny, jack"
tt2239822,
tt0398808,"children, imagination, world, imagine, imaginary, outcasts, life, real, taunt, peers, foes, changes"
tt1172570,"criminal, violent, british, story"
tt0416449,"spartan, sparta, spartans, persians, xerxes, persia, greeks, king, greek, persian, traitor"
tt0187078,"actor, snatch, cage, duvall, vinnie, seconds, robert, mobster, speed, fast, croft"
tt0114614,"naomi, kesslee, rebel, book, film, abducted, cusack, strip, girl, comics, dystopian, vengeance"
tt0264796,
tt0210945,"coaching, coach, coaches, boone, virginia, fairfax, denzel, arlington, schools, training, va"
tt0277296,"akkadians, balthazar, sorcerer, memnon, mathayus, kingdom, horde, ambushed, takmet, king, ancient, magician"
tt0122151,"butters, firearm, strangled, gun, murtaugh, lethal, scene, murdered, hostage, murtagh"
tt0125439,
tt0060107,"buffoon, theophanes, tarkovsky, andrei, monks, peasants, monastery, midsummer, monk, artistic, iconographer, vladimir"
tt0119643,"brad, death, drew, jake, mortal, claire, dead, hopkins, personification"
tt0120623,"ants, ant, grasshoppers, grasshopper, flik, spider, anthill, bugs, island, colony, sister, circus"
tt0086879,"salieri, mozart, salieris, amadeus, musicians, vienna, composer, musical, requiem, flute, music, opera"
tt0119683,"valjean, portrayal, novel, frenchman, victor, film, jean, cosette, french, napoleon, hugo"
tt0298203,"jimmy, rabbit, eminem, rapper, future, trailer, rap, shannon, thug"
tt0268380,
tt5867800,
tt0183505,"baileygates, jamal, harvey, dickie, brownlee, layla, fbi, black, sons, daniel"
tt0277027,"sams, dawson, daughter, parental, custody, child, mentally, ice, situation, caring"
tt3631112,"rachel, megan, emily, blonde, lisa, rebecca, laura, woman, relationship, married, imagination, marriage"
tt0120611,"vampire, vampires, vampirism, vamps, vamp, underworld, movie, scene, club, nightclub, wesley, blade"
tt0181865,"narcotics, drug, cocaine, cartel, guzmán, drugs, tijuana, frankie, notorious, juárez, poison, overdoses"
tt0414993,"mayan, mayans, underworld, monkeys, monkey, guatemalan, movie, conquistador, oncologist, tommy, nebula, conquistadors"
tt0103112,
tt1490017,"wizard, emmet, vitruvius, imagination, construction, builders, prophecy, evil, visions, worker, resistance"
tt4061010,
tt0106611,"runner, derice, bobsledder, runners, competing, racer, rawle, olympic, bobsled, athlete, bobsledding, race"
tt1386697,"superman, batman, harley, quinn, margot, bodyguard, waller, villains, guards, assassin, amanda"
tt1748122,"scout, scouts, scoutmaster, troop, ward, camp, orphan, camped, penzance, suzy, recruits"
tt0758746,"crystal, whitney, amanda, lake, young, ryan, camp, danielle, lone, friends, richie"
tt0119256,
tt2322441,"ana, grey, rasuk, clayton, shades, jennifer, steele, washington"
tt0117571,"casey, murderer, murder, movie, murders, killers, sidney, scene, film, ghost, killer, becker"
tt0120577,
tt0116282,"fargo, movie, scene, kidnapper, frozen, marge, kidnapping, cabin"
tt1798603,"willie, santa, willy, claus, billy, thornton, pop, ending, valet, movie, suicide"
tt0104348,"act, action, salesman, sales, takes, salesmen, behavior, estate, attorney, plays, movie, estates"
tt2872718,"night, nightcrawler, robbery, carjacking, nightcrawlers, loder, thief, detectives, cop, detective, crime, fence"
tt0070735,"gambling, lonnegan, hooker, betting, cash, poker, bets, movie, newman, stakes, money, robbed"
tt2713180,"sergeant, soldier, panzerfaust, tanks, tank, battlefield, fury, gunner, sherman, platoon, commanders, battle"
tt1872181,"spider, parker, spiderscut, osborn, movie, doom, scene, spiders, film, monster, escape"
tt0104454,
tt2015381,"planet, nebula, guardians, planets, universe, cameo, quill, earth, star"
tt1649419,"tsunami, flood, rescue, rescued, lucas, devastation, daniel, naomi, devastating, injured, reunite"
tt0388795,"cowboy, sheephand, ennis, ranching, sheep, ranch, trailer, brokeback, jake, summer, herding, rodeo"
tt0120586,"derek, scene, ryan, seth, truck, danny, scenes, car, crash, black, night, watched"
tt0046911,"christina, ending, divorce, mistreatment, drown, delassalle, relationship, consents, dies, mutual, movie"
tt0099674,"corleone, godfather, vito, keaton, tommasino, palermo, mafia, pacino, gangster, sicilian"
